id,content
1,Great product. Highly recommended!
1,Very satisfied with this purchase.
1,Top-notch service and communication.
2,Impressed with the product and value.
2,Easy to order and received quickly.
2,Perfect for my needs. Thank you!
3,Excellent quality and fast shipping.
3,Would buy from again. A+++
3,Highly recommended seller. A++++
4,Quick delivery and easy transaction.
4,Item arrived as described. Thank you!
4,No issues with the purchase. A+++
5,Fantastic product at a great price.
5,Highly recommend this seller.
5,Great service and fast shipping.
6,Smooth transaction and fast shipping.
6,Would do business with again. A+++
6,Product exceeds expectations. Thank you!
7,Superb quality and value. A+++
7,Customer service is top-notch.
7,Recommended seller. Thank you!
8,Fast shipping and great quality.
8,Item was just what I needed. Thanks!
8,Will order from here again. A+++
9,Excellent transaction. Thank you!
9,Product arrived quickly and as described.
9,Highly recommended seller. A++++
10,Quick and easy transaction. A+++
10,Very happy with this purchase.
10,Great seller. Thanks!